{
  "schema": "inshell.agent-docs.source-lock.v1",
  "schemaUrl": "/docs/source-lock.schema.json",
  "canonicalSchemaUrl": "https://inshell.art/docs/source-lock.schema.json",
  "documentationVersion": "2026-08-21-r2",
  "sourceRegistrySchema": "inshell.agent-docs.source-registry.v1",
  "purpose": "Exact-byte inventory of public knowledge-bearing inputs used to keep human and Agent documentation aligned across the repo.",
  "policy": {
    "scope": "Public knowledge-bearing sources across inshell.art, THOUGHT, $PATH, wallet, route, and read-only API boundaries.",
    "update": "When a registered source changes, update its owning source or lock, run pnpm docs:generate, review the generated docs and source lock, then run pnpm docs:check.",
    "check": "pnpm docs:check",
    "upstreamCheck": "pnpm check:upstream-releases"
  },
  "sourceTreeSha256": "a58597494dbb1f5bd27e447f7c214be34d1f5fd62e9357f614a1343dd4cda65f",
  "groups": [
    {
      "id": "public-docs",
      "title": "Public documentation sources",
      "owner": "inshell.art docs",
      "reason": "Human articles, Agent-readable content, authority maps, and machine-handoff selection.",
      "groupSha256": "f3ac009a981a289c9d9b40b9963ecd98b77967b08a9c5012ddeff287062af02f",
      "files": [
        {
          "path": "apps/home/src/content/AGENTS.md",
          "byteLength": 726,
          "sha256": "3eb4bc483178829aa38ed8e85d20e65538b7867c046037062af488bda06660e3"
        },
        {
          "path": "apps/home/src/content/docs-figure-logic.ts",
          "byteLength": 12507,
          "sha256": "209d42077582f36b7f3cac88d928ed3615d5387fe87048bd586ad8f1d2c6e399"
        },
        {
          "path": "apps/home/src/content/docs-source-registry.ts",
          "byteLength": 8298,
          "sha256": "9fa302e7661ab45e64e907722196fc8e4c902265edcad55d495acc5604f83f26"
        },
        {
          "path": "apps/home/src/content/docs.ts",
          "byteLength": 180802,
          "sha256": "46559558450decaef85c14b3e189f3c65cbb62dab19d522f337b8c66148e68e6"
        },
        {
          "path": "apps/home/src/content/thought-machine-handoff.ts",
          "byteLength": 13284,
          "sha256": "18d85210af01f82b60be5d63fc4bf94469f28464ce050c39ca7098cfb90a2521"
        },
        {
          "path": "docs/AGENTS.md",
          "byteLength": 24857,
          "sha256": "f267d9b2423ceb8087aacae1840f40905586a58d74bfad51cefcc1a72e52304c"
        },
        {
          "path": "docs/agent-native-figure-experiment.md",
          "byteLength": 3728,
          "sha256": "8042f985e3615e9fddd1a16fe1169cf56b289f2ac1832be54b0e7f30c0b226f8"
        },
        {
          "path": "scripts/generate-agent-docs.ts",
          "byteLength": 119280,
          "sha256": "5c0b06896665d5b969146f5d01342e022c96397a179fbd4650e5b433f7c8e36a"
        }
      ]
    },
    {
      "id": "home-app",
      "title": "Home, $PATH, Pulse, WILL, and shared docs runtime",
      "owner": "inshell.art Home App",
      "reason": "Public copy, interaction, route, gallery, detail, pricing, and visualization behavior.",
      "groupSha256": "e81e07f564d3825cb12d22468239138f1b275a0edf427e7a632fa82224b0e0fd",
      "files": [
        {
          "path": "apps/home/index.html",
          "byteLength": 2011,
          "sha256": "bdb517a748a5c2e9f486caae938f940cc07e8516c652844f77cca9409d6e86fc"
        },
        {
          "path": "apps/home/package.json",
          "byteLength": 3213,
          "sha256": "af70d6e0dfb5a8f11780e96ac648a45012133318aa4c71e6c96b9a18e503cd8b"
        },
        {
          "path": "apps/home/src/App.tsx",
          "byteLength": 18803,
          "sha256": "5021e4ba2492b4d8f796cd1eb1251f5dae9d40f8a6461dbd857eb930d423ef78"
        },
        {
          "path": "apps/home/src/assets/icon-github.svg",
          "byteLength": 989,
          "sha256": "eca10bc8ae1d8f8f5fa382c1b25e3ee033c06eef9c1fb55d23d0e85f01f91b05"
        },
        {
          "path": "apps/home/src/assets/icon-x.svg",
          "byteLength": 427,
          "sha256": "a0d697dfd94335ce81cabe740037fc534cd34c59d66c6e18c61c69302e486d79"
        },
        {
          "path": "apps/home/src/assets/react.svg",
          "byteLength": 4126,
          "sha256": "35ef61ed53b323ae94a16a8ec659b3d0af3880698791133f23b084085ab1c2e5"
        },
        {
          "path": "apps/home/src/components/AuctionCanvas.tsx",
          "byteLength": 268544,
          "sha256": "0830636868a697799533eb6554e6ed3a4337b1c34d3d544370ea0da785f48ca7"
        },
        {
          "path": "apps/home/src/components/ColorFontPage.tsx",
          "byteLength": 22887,
          "sha256": "a4bd8dcfb6de57e4e54cdd2d781ed02874db4f2efc027f666712a84cd82120dd"
        },
        {
          "path": "apps/home/src/components/DocsPage.tsx",
          "byteLength": 15585,
          "sha256": "552909987db0ab106f77888c2c54a65ecc74e4ea2112a469ef6c9ed359ee2044"
        },
        {
          "path": "apps/home/src/components/EcosystemHome.tsx",
          "byteLength": 7595,
          "sha256": "6133f605048d753ef50854e4381a3d84a1dcaee5992490a1b1e9264cf1caed9a"
        },
        {
          "path": "apps/home/src/components/FloatingReportBug.tsx",
          "byteLength": 1399,
          "sha256": "8b8469c3fb4d171b6d78747e7a4d493d8b74fe56118f42f537437c54dadb8138"
        },
        {
          "path": "apps/home/src/components/Footer/Footer.module.css",
          "byteLength": 1648,
          "sha256": "0ed72508f7408a3ee7df8aacc4f4bc3a88d2942f57c4d0996c74b036eed397ef"
        },
        {
          "path": "apps/home/src/components/Footer/Footer.tsx",
          "byteLength": 5571,
          "sha256": "96b50d77e9d368ef8c869328a37a00d004d6963d6ae3c19a70246cfc650bb349"
        },
        {
          "path": "apps/home/src/components/HeaderWalletCTA.tsx",
          "byteLength": 7823,
          "sha256": "c53b648f5e83da423c4e89bace7c1ceb777be501fa28d534adb9892c03c8985a"
        },
        {
          "path": "apps/home/src/components/Movements.css",
          "byteLength": 1511,
          "sha256": "40808ca146c7be0ee2a10e044a0ae50b71a4f5938ca6d85e50f1ce19b26ab981"
        },
        {
          "path": "apps/home/src/components/Movements.tsx",
          "byteLength": 3043,
          "sha256": "fa86e44531e694076bfa1099c1c73331912f40d9cf67ecada7713fb0ab95250b"
        },
        {
          "path": "apps/home/src/components/PathBeforeDeployCanvas.tsx",
          "byteLength": 1230,
          "sha256": "36195db5291b639754956f302187cec64346aba4531fa924a29167ac968081de"
        },
        {
          "path": "apps/home/src/components/PathPage.tsx",
          "byteLength": 43089,
          "sha256": "ed746205eb9ae26733dcfb9704e57a9dd56ddf4eed2f18dd3ce74bed3c7ff19f"
        },
        {
          "path": "apps/home/src/components/PreviewWatermark.tsx",
          "byteLength": 372,
          "sha256": "bf2949ba402274df649482459e48a69a8708a40e150405aaf870e47d15552527"
        },
        {
          "path": "apps/home/src/components/PulsePage.tsx",
          "byteLength": 21962,
          "sha256": "514ad949967c6dac8b4817bb5045984afa929b94f9fa114ec004046ab517d66d"
        },
        {
          "path": "apps/home/src/components/ThoughtDetailPage.tsx",
          "byteLength": 14309,
          "sha256": "abfc646bcfbabe7dd984272db5f142fe668218da14669714f9957f9144408eb3"
        },
        {
          "path": "apps/home/src/components/ThoughtGalleryPage.tsx",
          "byteLength": 8639,
          "sha256": "c7dc4ab98dc3f951ff2ca93489f864e4662b1b447bbf6654cf5d5254e9f2e637"
        },
        {
          "path": "apps/home/src/components/VerifyPage.tsx",
          "byteLength": 29174,
          "sha256": "7aed29a7094165e63b12d9dabfcd21f9f50889f2f331e11734f3d3cf9b2e196c"
        },
        {
          "path": "apps/home/src/components/WillPage.tsx",
          "byteLength": 631,
          "sha256": "1029fff11b8c5ddeefd45a5dde589c2d958376d22e16b5de291fa7311b470dbb"
        },
        {
          "path": "apps/home/src/components/docs/FieldFigureVisual.tsx",
          "byteLength": 13924,
          "sha256": "cc04bd7d9ad87ad889cdaf8d9dfc3c8f64195bfe79d7b8bac1e5a2924aa6ecdd"
        },
        {
          "path": "apps/home/src/components/docs/FlowFigureVisual.tsx",
          "byteLength": 9892,
          "sha256": "a019e3ff58ed146f01fe073638668c198087ce5e247a1c12cc8c64f6b26686ce"
        },
        {
          "path": "apps/home/src/components/docs/LaneFigureVisual.tsx",
          "byteLength": 5496,
          "sha256": "b5ff602944fb0c7031d02ff6bcd4e2ecbdb9d82626c4295518c266141ab83acd"
        },
        {
          "path": "apps/home/src/components/docs/figureLogicResolvers.ts",
          "byteLength": 1918,
          "sha256": "4535299571f95569ba0945367270d71d02c37a3abbe874231e1ef26a09d02806"
        },
        {
          "path": "apps/home/src/components/docs/figures.css",
          "byteLength": 20943,
          "sha256": "4d3e0e22fec99ea94f737ce017634c133dfdc9c8f18213cc4b36da2dbafae890"
        },
        {
          "path": "apps/home/src/components/docs/scrollHandoff.ts",
          "byteLength": 3139,
          "sha256": "5c859ee0c132701841139f9ba47ea05f09b1dbba19eb3a1b9291d9f938c02e0e"
        },
        {
          "path": "apps/home/src/config/publicLaunch.ts",
          "byteLength": 1975,
          "sha256": "0662acf8c5c1aeb0bbde24f609b6382bad994f6337b7a69240870420c58bd257"
        },
        {
          "path": "apps/home/src/content/colorFont.ts",
          "byteLength": 2532,
          "sha256": "96f03e9a16037cdb1793a35acf7ade2a4acb17a3d337d78825eec0e32c3cc972"
        },
        {
          "path": "apps/home/src/content/path.ts",
          "byteLength": 682,
          "sha256": "f4c1149bc285243b1b804cdc7ad9cf90e95f67d75d457e622ba908852929ec50"
        },
        {
          "path": "apps/home/src/content/pulse.ts",
          "byteLength": 1232,
          "sha256": "265b8384e2d3858a167ffa46fd1c92623b1909da924ff4a9e8fe51857b7e3924"
        },
        {